<?xml version="1.0" encoding="UTF-8"?>

<office xmlns:xsd="http://www.w3.org/2001/XMLSchema-instance" xsd:schemaLocation="C:\Users\User\Documents\Unipd\Tecnologie Web\Progetto\XML\studio.xsd">
	
	<story></story>
	
	
	<composition>
		
		<employee title="">
			<name></name>
			
			<pubblications>
				<pubblication n="1" date="2012-12-05"></pubblication>
				<pubblication n="2" date="2012-12-05"></pubblication>
			</pubblications>
			
			<contacts>
				<email></email>
				<linkedin></linkedin>
			</contacts>
			
			<curriculum></curriculum>
			
		</employee>
		
	</composition>
	
	
	<competenceAreas>
	
		<area name=""></area>
		<area name=""></area>
	
	</competenceAreas>


</office>